作者,诗歌名,诗歌原文,聚类类别
王维,横吹曲辞 陇头吟,长安少年游侠客，夜上戍楼看太白。陇头明月迥临关，陇上行人夜吹笛。关西老将不胜愁，驻马听之双泪流。身经大小百馀，麾下偏裨万户侯。苏武才为典属国，节旄空尽海西头。,豪侠交游类
张易之,横吹曲辞 出塞,侠客重恩光，骢马饰金装。瞥闻传羽檄，驰突救边荒。转战磨筓地，横行戴斗乡。将军占太白，小妇怨流黄。騕褭青丝骑，娉婷红粉妆。一春莺度曲，八月雁成行。谁堪坐秋思，罗袖拂空床。,豪侠交游类
杜甫,横吹曲辞 后出塞五首 四,献凯日继踵，两蕃静无虞。渔阳豪侠地，击鼓吹笙竽。云帆转辽海，粳稻来东吴。越罗与楚练，照耀舆台躯。主将位益崇，气骄陵上都。边人不敢议，议者死路衢。,侠义抒怀类
卢照邻,横吹曲辞 刘生,刘生气不平，抱剑欲专征。报恩为豪侠，死难在横行。翠羽装剑鞘，黄金饰马缨。但令一顾重，不吝百身轻。,侠义抒怀类
李白,相和歌辞 猛虎行,朝作猛虎行，暮作猛虎吟。肠断非关陇头水，泪下不为雍门琴。旌旗缤纷两河道，战鼓惊山欲倾倒。秦人半作燕地囚，胡马翻衔洛阳草。一输一失关下兵，朝降夕叛幽蓟城。巨鳌未斩海水动，鱼龙奔走安得宁。颇似楚汉时，翻覆无定止。朝过博浪沙，暮入淮阴市。张良未遇韩信贫，刘项存亡在两臣。暂到下邳受兵略，来投漂母作主人。贤哲栖栖古如此，今时亦弃青云士。有策不敢犯龙鳞，窜身南国避胡尘。宝书长剑挂高阁，金鞍骏马散故人。昨日方为宣城客，掣铃交通二千石。有时六博快壮心，绕床三帀呼一掷。楚人每道张旭奇，心藏风云世莫知。三吴邦伯多顾盼，四海雄侠皆相推。萧曹曾作沛中吏，攀龙附凤当有时。溧阳酒楼三月春，杨花漠漠愁杀人。胡人绿眼吹玉笛，吴歌白纻飞梁尘。丈夫相见且为乐，槌牛挝鼓会众宾。我从此去钓东海，得鱼笑寄情相亲。,侠义抒怀类
虞世南,相和歌辞 从军行二首 二,爟火发金微，连营出武威。孤城寒云起，绝阵虏尘飞。侠客吸龙剑，恶少缦胡衣。朝摩骨都垒，夜解谷蠡围。萧关远无极，蒲海广难依。沙磴离旌断，晴川候马归。交河梁已毕，燕山斾欲飞。方知万里相，侯服有光辉。,豪侠交游类
李益,相和歌辞 从军有苦乐行,劳者且勿歌，我欲送君觞。从军有苦乐，此曲乐未央。仆本居陇上，陇水断人肠。东过秦宫路，宫路入咸阳。时逢汉帝出，谏猎至长杨。讵驰游侠窟，非结少年场。一旦承嘉惠，轻命重恩光。秉笔参帷帟，从军至朔方。边地多阴风，草木自淒凉。断绝海云去，出没胡沙长。参差引雁翼，隐辚腾军装。剑文夜如水，马汗冻成霜。侠气五都少，矜功六郡良。山河起目前，睚眦死路傍。北逐驱獯虏，西临复旧疆。昔还赋馀资，今出乃赢粮。一矢弢夏服，我弓不再张。寄言丈夫雄，苦乐身自当。,隐逸怀古类
李白,舞曲歌辞 东海有勇妇,梁山感杞妻，恸哭为之倾。金石忽暂开，都由激深情。东海有勇妇，何慙苏子卿。学剑越处子，超腾若流星。捐躯报夫讐，万死不顾生。白刃耀素雪，苍天感精诚。十步两躩跃，三呼一交兵。斩首掉国门，蹴踏五藏行。割此伉俪愤，粲然大义明。北海李使君，飞章奏天庭。舍罪警风俗，流芳播沧瀛。志在列女籍，竹帛已光荣。淳于免诏狱，汉主为缇萦。津妾一櫂歌，脱父于严刑。十子若不肖，不如一女英。豫让斩空衣，有心竟无成。要离杀庆忌，壮夫素所轻。妻子亦何辜，焚之𧹒虚名。岂如东海妇，事立独扬名。,市井任侠类
李白,杂曲歌辞 白马篇,龙马花雪毛，金鞍五陵豪。秋霜切玉剑，落日明珠袍。鬬鸡事万乘，轩盖一何高。弓摧宜山虎，手接泰山猱。酒后竞风彩，三杯弄宝刀。杀人如翦草，剧孟同游遨。发愤去函谷，从军向临洮。叱咤万战场，匈奴尽波涛。归来使酒气，未肯拜萧曹。羞入原宪室，荒径隐蓬蒿。,侠义抒怀类
李颀,杂曲歌辞 缓歌行,小来讬身攀贵游，倾财破产无所忧。暮拟经过石渠署，朝将出入铜龙楼。结交杜陵轻薄子，谓言可生复可死。一沈一浮会有时，弃我翻然如脱屣。男儿立身须自彊，十五闭户颍水阳。业就功成见明主，击鐘鼎食坐华堂。二八蛾眉梳堕马，美酒清歌曲房下。文昌宫中赐锦衣，长安陌上退朝归。五侯宾从莫敢视，三省官僚揖者稀。早知今日读书是，悔作从来任侠非。,隐逸怀古类
虞羽客,杂曲歌辞 结客少年场行,幽幷侠少年，金络控连钱。窃符方救赵，击筑正怀燕。轻生辞凤阙，挥袂上祁连。陆离横宝剑，出没惊徂旃。蒙轮恒顾敌，超乘忽争先。摧枯逾百战，拓地远三千。骨都魂已散，楼兰首复传。龙城含晓雾，瀚海隔遥天。歌吹金微返，振旅玉门旋。烽火今已息，非复照甘泉。,侠义抒怀类
卢照邻,杂曲歌辞 结客少年场行,长安重游侠，洛阳富才雄。玉剑浮云骑，金鞍明月弓。鬬鸡过渭北，走马向关东。孙宾遥见待，郭解暗相通。不受千金爵，谁论万里功。将军下天上，虏骑入云中。烽火夜似月，兵气晓成虹。横行徇知己，负羽远从戎。龙旌昏朔雾，鸟阵卷寒风。追奔瀚海咽，战罢阴山空。归来谢天子，何如马上翁。,侠义抒怀类
李白,杂曲歌辞 少年行三首 三,君不见淮南少年游侠客，白日毬猎夜拥掷。呼卢百万终不惜，报讐千里如咫尺。少年游侠好经过，浑身装束皆绮罗。兰蕙相随喧妓女，风光去处满笙歌。骄矜自言不可有，侠士堂中养来久。好鞍好马乞与人，十千五千旋沽酒。赤心用尽为知己，黄金不惜栽桃李。桃李栽来几度春，一回花落一回新。府县尽为门下客，王侯皆是平交人。男儿百年且乐命，何须徇书受贫病。男儿百年且荣身，何须徇节甘风尘。衣冠半是征战士，穷儒浪作林泉民。遮莫枝根长百丈，不如当代多还往。遮莫姻亲连帝城，不如当身自簪缨。看取富贵眼前者，何用悠悠身后名。,豪侠交游类
王维,杂曲歌辞 少年行四首 一,新丰美酒斗十千，咸阳游侠多少年。相逢意气为君饮，繫马高楼垂柳边。,隐逸怀古类
王维,杂曲歌辞 少年行四首 三,出身仕汉羽林郎，初随骠骑战渔阳。孰知不向边庭苦，纵死犹闻侠骨香。,市井任侠类
王昌龄,杂曲歌辞 少年行二首 一,西陵侠年少，送客过长亭。青槐夹两路，白马如流星。闻道羽书急，单于寇井陉。气高轻赴难，谁顾燕山铭。,侠义抒怀类
高适,杂曲歌辞 邯郸少年行,邯郸城南游侠子，自矜生长邯郸里。千场纵博家仍富，几度报讐身不死。宅中歌笑日纷纷，门外车马如云屯。未知肝胆向谁是，令人却忆平原君。君不见今人交态薄，黄金用尽还疎索。以兹感激辞旧游，更于时事无所求。且与少年饮美酒，往来射猎西山头。,隐逸怀古类
崔颢,杂曲歌辞 游侠篇,少年负胆气，好勇复知机。仗剑出门去，孤城逢合围。杀人辽水上，走马渔阳归。错落金琐甲，蒙茸貂鼠衣。还家行且猎，弓矢速如飞。地迥鹰犬疾，草深狐兔肥。腰间悬两绶，转眄生光辉。,侠义抒怀类
孟郊,杂曲歌辞 游侠行,壮士性刚决，火中见石裂。杀人不迴头，轻生如暂别。岂知眼有泪，肯白头上髮。平生无恩酬，剑閑一百月。,侠义抒怀类
李白,杂曲歌辞 侠客行,赵客缦胡缨，吴钩霜雪明。银鞍照白马，飒沓如流星。十步杀一人，千里不留行。事了拂衣去，深藏身与名。閑过信陵饮，脱剑膝前横。将炙啖朱亥，持觞劝侯嬴。三杯吐然诺，五岳倒为轻。眼花耳热后，意气素霓生。救赵挥金槌，邯郸先震惊。千秋二壮士，烜赫大梁城。纵死侠骨香，不慙世上英。谁能书阁下，白首太玄经。,市井任侠类
元稹,杂曲歌辞 侠客行,侠客不怕死，怕在事不成。事成不肯藏姓名，我非窃贼谁夜行。白日堂堂杀袁盎，九衢草草人面青。此客此心师海鲸，海鲸露背横沧溟。海滨分作两处生，海鲸分海减海力。侠客有谋人不测，三尺铁蛇延二国。,边塞报国类
万楚,杂曲歌辞 茱萸女,山阴柳家女，九日采茱萸。复得东邻伴，双为陌上姝。插花向高髻，结子置长裾。作性恒迟缓，非关诧丈夫。平明折林树，日入反城隅。侠客邀罗袖，行人挑短书。蛾眉自有主，年少莫踟蹰。,豪侠交游类
虞世南,从军行二首 二,烽火发金微，连营出武威。孤城塞云起，绝阵虏尘飞。侠客吸龙剑，恶少缦胡衣。朝摩骨都垒，夜解谷蠡围。萧关远无极，蒲海广难依。沙磴离旌断，晴川候马归。交河梁已毕，燕山斾欲挥。方知万里相，侯服见光辉。,豪侠交游类
陈子良,游侠篇,洛阳丽春色，游侠骋轻肥。水逐车轮转，尘随马足飞。云影遥临盖，花气近薰衣。东郊鬬鸡罢，南皮射雉归。日暮河桥上，扬鞭惜晚晖。,隐逸怀古类
卢照邻,结客少年场行,长安重游侠，洛阳富财雄。玉剑浮云骑，金鞭明月弓。鬬鸡过渭北，走马向关东。孙宾遥见待，郭解暗相通。不受千金爵，谁论万里功。将军下天上，虏骑入云中。烽火夜似月，兵气晓成虹。横行徇知己，负羽远从戎。龙旌昏朔雾，鸟阵捲胡风。追奔瀚海咽，战罢阴山空。归来谢天子，何如马上翁。,侠义抒怀类
卢照邻,长安古意,长安大道连狭斜，青牛白马七香车。玉辇纵横过主第，金鞭络绎向侯家。龙衔宝盖承朝日，凤吐流苏带晚霞。百丈游丝争绕树，一群娇鸟共啼花。啼花戏蝶千门侧，碧树银台万种色。複道交窗作合欢，双阙连薨垂凤翼。梁家画阁天中起，汉帝金茎云外直。楼前相望不相知，陌上相逢讵相识。借问吹箫向紫烟，曾经学舞度芳年。得成比目何辞死，𫖸作鸳鸯不羡仙。比目鸳鸯真可羡，双去双来君不见。生憎帐额绣孤鸾，好取门帘帖双燕。双燕双飞绕画梁，罗帏翠被郁金香。片片行云著蝉鬓，纤纤初月上鸦黄。鸦黄粉白车中出，含娇含态情非一。妖童宝马铁连钱，娼妇盘龙金屈膝。御史府中乌夜啼，廷尉门前雀欲栖。隐隐朱城临玉道，遥遥翠幰没金堤。挟弹飞鹰杜陵北，探丸借客渭桥西。俱邀侠客芙蓉剑，共宿娼家桃李蹊。娼家日暮紫罗裙，清歌一啭口氛氲。北堂夜夜人如月，南陌朝朝骑似云。南陌北堂连北里，五剧三条控三市。弱柳青槐拂地垂，佳气红尘暗天起。汉代金吾千骑来，翡翠屠苏鹦鹉杯。罗襦宝带为君解，燕歌赵舞为君𫔭。别有豪华称将相，转日回天不相让。意气由来排灌夫，专权判不容萧相。专权意气本豪雄，青虬紫燕坐春风。自言歌舞长千载，自谓骄奢凌五公。节物风光不相待，桑田碧海须臾改。昔时金阶白玉堂，即今唯见青松在。寂寂寥寥扬子居，年年岁岁一床书。独有南山桂花发，飞来飞去袭人裾。,豪侠交游类
卢照邻,刘生,刘生气不平，抱剑欲专征。报恩为豪侠，死难在横行。翠羽装刀鞘，黄金饰马铃。但令一顾重，不恡百身轻。,侠义抒怀类
杨炯,骢马,骢马铁连钱，长安侠少年。帝畿平若水，官路直如弦。夜玉妆车轴，秋金铸马鞭。风霜但自保，穷达任皇天。,隐逸怀古类
杨炯,紫骝马,侠客重周游，金鞭控紫骝。蛇弓白羽箭，鹤辔赤茸鞦。发迹来南海，长鸣向北州。匈奴今未灭，画地取封侯。,豪侠交游类
李峤,弹,侠客持苏合，佳游满帝乡。避丸深可诮，求炙遂难忘。金迸疑星落，珠沈似月光。谁知少孺子，将此见吴王。,豪侠交游类
李峤,桂,未殖银宫里，宁移玉殿幽。枝生无限月，花满自然秋。侠客条为马，仙人叶作舟。愿君期道术，攀折可淹留。,豪侠交游类
郭震,古剑篇,君不见昆吾铁冶飞炎烟，红光紫气俱赫然。良工锻鍊凡几年，铸得宝剑名龙泉。龙泉颜色如霜雪，良工咨嗟歎奇绝。琉璃玉匣吐莲花，错镂金环映明月。正逢天下无风尘，幸得周防君子身。精光黯黯青蛇色，文章片片绿龟鳞。非直结交游侠子，亦曾亲近英雄人。何言中路遭弃捐，零落漂沦古狱边。虽复尘埋无所用，犹能夜夜气冲天。,隐逸怀古类
韦元旦,奉和九日幸临渭亭登高应制得月字,云物开千里，天行乘九月。丝言丹凤池，斾转苍龙阙。灞水欢娱地，秦京游侠窟。欣承解愠词，圣酒黄花发。,隐逸怀古类
蔡孚,打毬篇,德阳宫北苑东头，云作高台月作楼。金鎚玉蓥千金地，宝杖琱文七宝毬。窦融一家三尚主，梁翼频封万户侯。容色由来荷恩顾，意气平生事侠游。共道用兵如断蔗，俱能走马入长楸。红鬣锦鬃风𫘧骥，黄络青丝电紫骝。奔星乱下花场里，初月飞来画杖头。自有长鸣须决胜，能驰迅走满先筹。薄暮汉宫愉乐罢，还归尧室晓垂旒。,侠义抒怀类
骆宾王,帝京篇,山河千里国，城阙九重门。不覩皇居壮，安知天子尊。皇居帝里崤函谷，鹑野龙山侯甸服。五纬连影集星躔，八水分流横地轴。秦塞重关一百二，汉家离宫三十六。桂殿嵚岑对玉楼，椒房窈窕连金屋。三条九陌丽城隈，万户千门平旦开。複道斜通鳷鹊观，交衢直指凤皇台。剑履南宫入，簪缨北阙来。声名冠寰宇，文物象昭回。钩陈肃兰戺，璧沼浮槐市。铜羽应风回，金茎承露起。校文天禄阁，习战昆明水。朱邸抗平台，黄扉通戚里。平台戚里带崇墉，炊金馔玉待鸣鐘。小堂绮帐三千户，大道青楼十二重。宝盖雕鞍金络马，兰窗绣柱玉盘龙。绣柱璇题粉壁映，锵金鸣玉王侯盛。王侯贵人多近臣，朝游北里暮南邻。陆贾分金将䜩喜，陈遵投辖正留宾。赵李经过密，萧朱交结亲。丹凤朱城白日暮，青牛绀幰红尘度。侠客珠弹垂杨道，倡妇银钩采桑路。倡家桃李自芳菲，京华游侠盛轻肥。延年女弟双凤入，罗敷使君千骑归。同心结缕带，连理织成衣。春朝桂尊尊百味，秋夜兰灯灯九微。翠幌珠帘不独映，清歌宝瑟自相依。且论三万六千是，宁知四十九年非。古来荣利若浮云，人生倚伏信难分。始见田窦相移夺，俄闻衞霍有功勋。未厌金陵气，先开石椁文。朱门无复张公子，灞亭谁畏李将军。相顾百龄皆有待，居然万化咸应改。桂枝芳气已销亡，柏梁高宴今何在？春去春来苦自驰，争名争利徒尔为。久留郎署终难遇，空扫相门谁见知。当时一旦擅豪华，自言千载长骄奢。倏忽抟风生羽翼，须臾失浪委泥沙。黄雀徒巢桂，青门遂种瓜。黄金销铄素丝变，一贵一贱交情见。红颜宿昔白头新，脱粟布衣轻故人。故人有湮沦，新知无意气。灰死韩安国，罗伤翟廷尉。已矣哉，归去来。马卿辞蜀多文藻，扬雄仕汉乏良媒。三冬自矜诚足用，十年不调几邅回。汲黯薪逾积，孙弘阁未开。谁惜长沙傅，独负洛阳才。,豪侠交游类
骆宾王,畴昔篇,"少年重英侠，弱岁贱衣冠。既讬寰中赏，方承膝下欢。遨游灞水曲，风月洛城端。且知无玉馔，谁肯逐金丸。金丸玉馔盛繁华，自言轻侮季伦家。五霸争驰千里马，三条竞骛七香车。掩映飞轩乘落照，参差步障引朝霞。池中旧水如悬镜，屋里新妆不让花。意气风云倏如昨，岁月春秋屡回薄。上苑频经柳絮飞，中园几见梅花落。当时门客今何在？畴昔交朋已疎索。莫教憔悴损容仪，会得高秋云雾廓。淹留坐帝乡，无事积炎凉。一朝披短褐，六载奉长廊。赋文慙昔马，执戟歎前扬。挥戈出武帐，荷笔入文昌。文昌隐隐皇城里，由来奕奕多才子。潘陆词锋骆驿飞，张曹翰苑纵横起。卿相未曾识，王侯宁见拟。垂钓甘成白首翁，负薪何处逢知己？,判将运命赋穷通，从来奇舛任西东。不应永弃同刍狗，且复飘飖类转蓬。容鬓年年异，春华岁岁同。荣观未尽礼，徇主欲申功。脂车秣马辞乡国，萦辔西南使邛僰。玉垒铜梁不易攀，地角天涯眇难测。莺啭蝉吟有悲望，鸿来雁度无音息。阳关积雾万里昏，剑阁连山千种色。蜀路何悠悠，岷峰阻且修。回肠随九折，迸泪连双流。寒光千里暮，露气二江秋。长途看束马，平水且沈牛。华阳旧地标神制，石镜蛾眉真秀丽。诸葛才雄已号龙，公孙跃马轻称帝。五丁卓荦多奇力，四士英灵富文艺。云气横开八阵形，桥形遥分七星势。川平烟雾开，游戏锦城隈。墉高龟望出，水净雁文回。寻姝入酒肆，访客上琴台。不识金貂重，偏惜玉山颓。他乡冉冉消年月，帝里沈沈限城阙。不见猿声助客啼，唯闻旅思将花发。我家迢递关山里，关山迢递不可越。故园梅柳尚馀春，来时勿使芳菲歇。解鞅欲言归，执袂怆多违。北梁俱握手，南浦共沾衣。别情伤去盖，离念惜徂辉。知音何所托，木落雁南飞。回来望平陆，春来酒应熟。相将菌阁卧青溪，且用藤杯泛黄菊。十年不调为贫贱，百日屡迁随倚伏。祗为须求负郭田，使我再干州县禄。百年郁郁少腾迁，万里遥遥入镜川。涘江拂潮冲白日，淮海长波接远天。丛竹凝朝露，孤山起暝烟。赖有边城月，常伴客旌悬。东南美箭称吴会，名都隐轸三江外。涂山执玉应昌期，曲水开襟重文会。仙镝流音鸣鹤岭，宝剑分辉落蛟濑。未看白马对芦刍，且觉浮云似车盖。江南节序多，文酒屡经过。共踏春江曲，俱唱采菱歌。舟移疑入镜，棹举若乘波。风光无限极，归檝碍池荷。眺听烟霞正流眄，即从王事归舻转。芝田花月屡裴回，金谷佳期重游衍。登高北望嗤梁叟，凭轼西征想潘掾。峰开华岳耸疑莲，水激龙门急如箭。人事谢光阴，俄遭霜露侵。偷存七尺影，分没九泉深。穷途行泣玉，愤路未藏金。茹荼空有歎，怀橘独伤心。年来岁去成销铄，怀抱心期渐寥落。挂冠裂冕已辞荣，南亩东臯事耕凿。宾阶客院常疏散，蓬径柴扉终寂寞。自有林泉堪隐栖，何必山中事丘壑。我住青门外，家临素浐滨。遥瞻丹凤阙，斜望黑龙津。荒衢通猎骑，穷巷抵樵轮。时有桃源客，来访竹林人。昨夜琴声奏悲调，旭旦含颦不成笑。果乘骢马发嚣书，复道郎官禀纶诰。冶长非罪曾缧絏，长孺然灰也经溺。高门有阅不图封，峻笔无闻歛敷妙。适离京兆谤，还从御史弹。炎威资夏景，平曲况秋翰。画地终难入，书空自不安。吹毛未可待，摇尾且求餐。丈夫坎壈多愁疾，契阔迍邅尽今日。慎罚宁凭两造辞，严科直挂三章律。邹衍衔悲繫燕狱，李斯抱怨拘秦桎。不应白髮顿成丝，直为黄沙暗如漆。紫禁终难呌，朱门不易排。惊魂闻叶落，危魄逐轮埋。霜威遥有厉，雪枉遂无阶。含冤欲谁道，饮气独居怀。忽闻驿使发关东，传道天波万里通。涸鳞去辙还游海，幽禽释网便翔空。舜泽尧曦方有极，谗言巧佞傥无穷。谁能跼迹依三辅，会就商山访四翁。",侠义抒怀类
骆宾王,代女道士王灵妃赠道士李荣,玄都五府风尘绝，碧海三山波浪深。桃实千年非易待，桑田一变已难寻。别有仙居对三市，金阙银宫相向起。台前镜影伴仙娥，楼上箫声随凤史。凤楼迢递绝尘埃，莺时物色正裴回。灵芝紫检参差长，仙桂丹花重叠开。双童绰约时游陟，三鸟联翩报消息。尽言真侣出遨游，传道风光无限极。轻花委砌惹裾香，残月窥窗觇幌色。箇时无数倂妖妍，箇里无穷总可怜。别有众中称黜帝，天上人间少流例。洛滨仙驾启遥源，淮浦灵津符远筮。自言少小慕幽玄，只言容易得神仙。珮中邀勒经时序，箫里寻思复几年。寻思许事真情变，二人容华识少选。漫道烧丹止七飞，空传化石曾三转。寄语天上弄机人，寄语河边值查客。乍可悤悤共百年，谁使遥遥期七夕。想知人意自相寻，果得深心共一心。一心一意无穷已，投漆投胶非足拟。只将羞涩当风流，持此相怜保终始。相怜相念倍相亲，一生一代一双人。不把丹心比玄石，惟将浊水况清尘。只言柱下留期信，好欲将心学松蕣。不能京兆画峨眉，翻向成都骋驺引。青牛紫气度灵关，尺素赩鳞去不还。连苔上砌无穷绿，修竹临坛几处斑。此时空床难独守，此日别离那可久。梅花如雪柳如丝，年去年来不自持。初言别在寒偏在，何悟春来春更思。春时物色无端绪，双枕孤眠谁分许。分念娇莺一种啼，生憎燕子千般语。朝云旭日照青楼，迟晖丽色满皇州。落花泛泛浮灵沼，垂柳长长拂御沟。御沟大道多奇赏，侠客妖容递来往。宝骑连花铁作钱，香轮骛水珠为网。香轮宝骑竞繁华，可怜今夜宿倡家。鹦鹉杯中浮竹叶，凤凰琴里落梅花。许辈多情偏送款，为问春花几时满。千回鸟信说众诸，百过莺啼说长短。长短众诸判不寻，千回百过浪关心。何曾举意西邻玉，未肯留情南陌金。南陌西邻咸自保，还辔归期须及早。为想三春狭斜路，莫辞九折邛关道。假令白里似长安，须使青牛学剑端。𬞟风入驭来应易，竹杖成龙去不难。龙飙去去无消息，鸾镜朝朝减容色。君心不记下山人，妾欲空期上林翼。上林三月鸿欲稀，华表千年鹤未归。不分淹留桑路待，秪应直取桂轮飞。,豪侠交游类
骆宾王,送郑少府入辽共赋侠客远从戎,边烽警榆塞，侠客度桑乾。柳叶开银镝，桃花照玉鞍。满月临弓影，连星入剑端。不学燕丹客，空歌易水寒。,豪侠交游类
张易之,出塞,侠客重恩光，骏马饰金装。瞥闻传羽檄，驰突救边荒。转战磨笄地，横行戴斗乡。将军占太白，小妇怨流黄。騕褭青丝骑，娉婷红粉妆。一春莺度曲，八月雁成行。谁堪坐秋思，罗袖拂空床。,豪侠交游类
张说,江路忆郡,雾敛江早明，星翻汉将没。卧闻峡猿响，起视榜人发。倚棹攀岸筿，凭船弄波月。水宿厌洲渚，晨光屡挥忽。林泽来不穷，烟波去无歇。结思笙竽里，摇情游侠窟。年貌不暂留，欢愉及玄髪。云涓恋山海，禽马怀燕越。自非行役人，安知慕城阙。,隐逸怀古类
张柬之,出塞,侠客重恩光，骢马饰金装。瞥闻传羽檄，驰突救边荒。歙野山川动，嚣天旌斾扬。吴钩明似月，楚剑利如霜。电断冲胡塞，风飞出洛阳。转战磨笄俗，横行戴斗乡。手擒郅支长，面缚谷蠡王。将军占太白，小妇怨流黄。騕褭青丝骑，娉婷红粉妆。三春莺度曲，八月鴈成行。谁堪坐愁思，罗袖拂空床。,豪侠交游类
贺朝,从军行,朔胡乘月寇边城，军书插羽刺中京。天子金坛拜飞将，单于玉塞振佳兵。骑射先鸣推任侠，龙韬决胜伫时英。闻有河湟客，愔愔理帷帟。常山启霸图，汜水先天策。衔珠浴铁向桑乾，衅旗膏剑指乌丸。鸣鸡已报关山晓，来雁遥传沙塞寒。直为甘心从苦节，陇头流水鸣呜咽。边树萧萧不觉春，天山漠漠长飞雪。鱼丽阵接塞云平，雁翼营通海月明。始看晋幕飞鹅入，旋闻齐垒啼乌声。自从一戍燕支山，春光几度晋阳关。金河未转青丝骑，玉筯应啼红粉颜。鸿归燕相续，池边芳草绿。已见氛清细柳营，莫更春歌落梅曲。烽沈灶减静边亭，海晏山空肃已宁。行望凤京旋凯捷，重来麟阁画丹青。,侠义抒怀类
王维,送高适弟耽归临淮作,少年客淮泗，落魄居下邳。遨游向燕赵，结客过临淄。山东诸侯国，迎送纷交驰。自尔厌游侠，闭户方垂帷。深明戴家礼，颇学毛公诗。备知轻济道，高卧陶唐时。圣主诏天下，贤人不得遗。公吏奉𫄸组，安车去茅茨。君王苍龙阙，九门十二逵。群公朝谒罢，冠剑下丹墀。野鹤终踉跄，威凤徒参差。或问理人术，但致还山词。天书降北阙，赐帛归东菑。都门谢亲故，行路日逶迟。孤帆万里外，淼漫将何之。江天海陵郡，云日淮南祠。杳冥沧洲上，荡漭无人知。纬萧或卖药，出处安能期。,隐逸怀古类
王维,济上四贤咏 崔录事,解印归田里，贤哉此丈夫。少年曾任侠，晚节更为儒。遯迹东山下，因家沧海隅。已闻能狎鸟，余欲共乘桴。,侠义抒怀类
王维,济上四贤咏 成文学,宝剑千金装，登君白玉堂。身为平原客，家有邯郸娼。使气公卿坐，论心游侠场。中年不得意，谢病客游梁。,隐逸怀古类
